{
  "$schema": "https://json-schema.org/draft/2020-12/schema",
  "title": "Divergence",
  "description": "A tracked divergence (join-spine `scenario_id` row). `run_seq`/\n`round` are the fold-ordering fields the design doc's Risk section\ncalls out for `Divergence`/`EvidenceRecord` — mirrors\n`divergence-log.md`'s \"serialized-integrator monotonic `run_seq`\n(primary), `round` (tiebreak-only)\" fold rule; the fold algorithm\nitself lives in [`crate::fold`]. `project_id` is REQUIRED (design\nD6, clean cutover) and, together with `scenario_id`, is the fold's\ngrouping key.",
  "type": "object",
  "properties": {
    "actor": {
      "$ref": "#/$defs/Actor"
    },
    "at": {
      "type": "string",
      "format": "date-time"
    },
    "detail": {
      "type": "string"
    },
    "kind": {
      "$ref": "#/$defs/RecordKind"
    },
    "project_id": {
      "$ref": "#/$defs/ProjectId"
    },
    "reviewer": {
      "type": "string"
    },
    "round": {
      "type": "integer",
      "format": "uint32",
      "minimum": 0
    },
    "run_seq": {
      "description": "The SOLE primary fold-ordering key within a `(project_id,\nscenario_id)` group — `round` below is a tiebreak ONLY among\nequal `run_seq` values, never an independent ordering axis.",
      "$ref": "#/$defs/TotalOrder"
    },
    "scenario_id": {
      "$ref": "#/$defs/ScenarioId"
    },
    "schema": {
      "description": "Per-kind FORMAT GENERATION — the value\n[`RecordKind::schema_version`] defines and every writer stamps\nvia [`Envelope::current`] (design D2; `canon fmt`/`canon\nmigrate`, S11, key off it; `canon_store::fold::fold_latest_by_key`\norders an equal-`at` supersession tie by it,\n`s38-evidence-bearing-memory`). See\n[`RecordKind::schema_version`] for the bump rule — it is \"bump\nwhen two generations of one record can tie on `at`\", not \"bump on\nevery field addition\".",
      "type": "integer",
      "format": "uint32",
      "minimum": 0
    },
    "sha": {
      "$ref": "#/$defs/Sha"
    },
    "status": {
      "$ref": "#/$defs/DivergenceStatus"
    }
  },
  "required": [
    "schema",
    "kind",
    "at",
    "actor",
    "project_id",
    "scenario_id",
    "sha",
    "status",
    "run_seq",
    "round",
    "reviewer"
  ],
  "$defs": {
    "Actor": {
      "description": "Who/what produced a record — structured, never a bare `by: String`\n(design D2, the donor audit's biggest cross-family gap).\n\n`role` is `Option` (S11 design D5, \"actor backfill is best-effort\nfrom adjacent fields; absent stays absent\"): a migrated legacy\nrecord whose only source field is a bare `by: \"legacy-ci-machine\"`\nstring carries no role information at all — `canon migrate` maps\nthat string to `agent_id` and leaves `role: null` rather than\nguessing, so the field must be able to express \"unknown\", not just\n\"known\". Every record canon itself originates still supplies a role\nvia [`Actor::new`]; only backfilled/migrated records use\n[`Actor::new_unattributed`].",
      "type": "object",
      "properties": {
        "agent_id": {
          "type": "string"
        },
        "model": {
          "type": [
            "string",
            "null"
          ]
        },
        "role": {
          "anyOf": [
            {
              "$ref": "#/$defs/RoleId"
            },
            {
              "type": "null"
            }
          ]
        },
        "session_id": {
          "anyOf": [
            {
              "$ref": "#/$defs/SessionId"
            },
            {
              "type": "null"
            }
          ]
        }
      },
      "required": [
        "agent_id"
      ]
    },
    "CheckPin": {
      "description": "What one role's latest evidence for a scenario said (0.23 D5): its\nverdict and the identity of the checks it bound. A report-backed\nrecord's checks are `<format>:<case name>` for each matched case; an\nartifact-only record's are `sha256:<digest>` for each file. New\nevidence with the same verdict and the same checks is the same pin.",
      "type": "object",
      "properties": {
        "checks": {
          "description": "Sorted, each once.",
          "type": "array",
          "items": {
            "type": "string"
          }
        },
        "role": {
          "type": [
            "string",
            "null"
          ]
        },
        "verdict": {
          "$ref": "#/$defs/EvidenceVerdict"
        }
      },
      "required": [
        "verdict",
        "checks"
      ]
    },
    "DivergenceStatus": {
      "description": "A divergence's fold-relevant state (design D8). `Open`/`Resolved`\nare the pre-s15 pair (still bare `\"open\"`/`\"resolved\"` on the wire —\nunaffected by the two additive variants below); `StillDivergent` is\na re-review that found the divergence persists; `Deferred` postpones\nreview until `expiry` (honored by [`crate::fold::fold_to_current_state`]'s\n`as_of` parameter). `ResolvedInvalid` deliberately does NOT exist\nhere — it is a fold-time-DERIVED [`crate::fold::FoldedState`]\noutput, never a persisted status (design D8/D9: the on-disk record\nis never rewritten to reflect a stale binding).\n\n`Accepted` (0.22) is a reviewer's disposition of a known gap: the\nscenario's latest evidence is `divergent`, and the gap is tracked\nelsewhere (`tracking`). It is bound to the evidence it saw\n(`evidence`, the same pins a [`Review`] carries), so new evidence\nends it, and it lapses at `expiry` when one is set. The ship guard\nand `canon gate check` read it ([`crate::fold`] only reports it).",
      "oneOf": [
        {
          "type": "string",
          "enum": [
            "open",
            "resolved",
            "still_divergent"
          ]
        },
        {
          "type": "object",
          "properties": {
            "deferred": {
              "type": "object",
              "properties": {
                "expiry": {
                  "type": "string",
                  "format": "date-time"
                },
                "reason": {
                  "type": "string"
                }
              },
              "required": [
                "reason",
                "expiry"
              ]
            }
          },
          "additionalProperties": false,
          "required": [
            "deferred"
          ]
        },
        {
          "type": "object",
          "properties": {
            "accepted": {
              "type": "object",
              "properties": {
                "checks": {
                  "description": "The scenario's latest evidence at acceptance (0.23): verdict and\nchecks per role, the pin a review carries.",
                  "type": [
                    "array",
                    "null"
                  ],
                  "items": {
                    "$ref": "#/$defs/CheckPin"
                  }
                },
                "evidence": {
                  "description": "The latest evidence record files at acceptance (0.22). Read\nonly by `canon migrate`.",
                  "type": "array",
                  "items": {
                    "$ref": "#/$defs/EvidencePin"
                  }
                },
                "expiry": {
                  "type": [
                    "string",
                    "null"
                  ],
                  "format": "date-time"
                },
                "reason": {
                  "type": "string"
                },
                "tracking": {
                  "description": "Where the gap is tracked: an issue URL or reference.",
                  "type": "string"
                }
              },
              "required": [
                "reason",
                "tracking"
              ]
            }
          },
          "additionalProperties": false,
          "required": [
            "accepted"
          ]
        }
      ]
    },
    "EvidencePin": {
      "description": "One pinned evidence record (0.15–0.22): its ledger natural key (the\n`task_id`, else the `scenario_id`, it is filed under) and its 12-hex\ncontent digest, together the record's ledger file stem `<key>__<digest>`.",
      "type": "object",
      "properties": {
        "digest": {
          "type": "string"
        },
        "key": {
          "type": "string"
        }
      },
      "required": [
        "key",
        "digest"
      ]
    },
    "EvidenceVerdict": {
      "description": "The three-way verdict an evidence record carries. `Divergent` is an\nexplicit third value rather than \"no record exists\" — the donor\nparity harness represents non-faithful as *absence* of a\ndesign-review/code-review record, which works for a directory-scanned\nledger but not for a single, standalone canon record whose own\n`Deserialize` must always succeed or fail on its own — so canon makes\nthe state explicit instead of leaning on record-absence.",
      "type": "string",
      "enum": [
        "faithful",
        "not_applicable",
        "divergent"
      ]
    },
    "ProjectId": {
      "description": "`[a-z0-9][a-z0-9-]*` — lowercase alnum + hyphen, first character alphanumeric, no underscore (keeps the `__` natural-key separator unambiguous) — joins: not a join-spine key; composite identity prefix on Scenario/Review/Divergence natural keys (`<project_id>__<scenario_id>…`), optional on EvidenceRecord",
      "type": "string"
    },
    "RecordKind": {
      "description": "The fourteen closed record kinds `canon-model` recognizes (design D1;\n`Subject` is the reviewed 13th kind, added by s36, and `Finding` the\nreviewed 14th, added by s43 — the \"a new kind is a reviewed, breaking\n`canon-model` change\" process design D1 mandates, exercised twice for\nreal). A fifteenth kind is again a reviewed, breaking\nchange — never a `kind: String` escape hatch (design D1's explicitly\nrejected alternative: an untyped `payload: serde_json::Value` would\nsilently recreate the \"no documented join key\" problem inside canon\nitself).",
      "type": "string",
      "enum": [
        "change",
        "task",
        "scenario",
        "session",
        "run",
        "event",
        "handoff",
        "review",
        "divergence",
        "trajectory",
        "strategy_item",
        "evidence_record",
        "subject",
        "finding"
      ]
    },
    "RoleId": {
      "description": "kebab-case role slug (`[a-z0-9]+(-[a-z0-9]+)*`), e.g. `implementer`, `reviewer` — joins: not a join-spine key; used by `Actor.role` and `regime_key`'s `<role>` segment",
      "type": "string"
    },
    "ScenarioId": {
      "description": "`<area>.<surface>.<nn>` — `[a-z0-9-]+\\.[a-z0-9-]+\\.\\d{2,}`; never renumbered once assigned — joins: spec ↔ test ↔ ledger ↔ divergence",
      "type": "string"
    },
    "SessionId": {
      "description": "opaque, non-empty agent-CLI session token; derivation source varies by adapter (Claude Code/Codex: transcript filename stem; omp/pi: in-file header `id` field) — this type validates shape only, never a single fixed format — joins: session ↔ cost ↔ run ↔ trajectory",
      "type": "string"
    },
    "Sha": {
      "description": "git commit SHA-1: exactly 40 lowercase hex characters — joins: reward signals ↔ trajectory",
      "type": "string"
    },
    "TotalOrder": {
      "description": "monotonic fold-ordering rank (e.g. Divergence.run_seq) — the SOLE primary sort key within a fold group; never compared against a round tiebreak",
      "type": "integer",
      "format": "uint64",
      "minimum": 0
    }
  }
}
